"DESCRIPTION","DURATION IN MS","NAME","PARENT SUITE","START TIME","STATUS","STOP TIME","SUB SUITE","SUITE","TEST CLASS","TEST METHOD"
"Tests that we can reuse storage from a different cluster.

    For that, we completely remove the application while keeping the storages,
    and then we deploy a new application with storage reuse and check that the
    storage has been reused.
    ","0","test_storage_re_use_different_cluster","tests.integration.ha_tests","Tue Nov 19 04:16:15 UTC 2024","skipped","Tue Nov 19 04:16:15 UTC 2024","","test_ha","",""
"Test that log are being rotated.","665795","test_log_rotate","tests.integration","Tue Nov 19 04:27:26 UTC 2024","passed","Tue Nov 19 04:38:31 UTC 2024","","test_charm","",""
"Verifies that the preflight check can run successfully.","165135","test_preflight_check_failure","tests.integration.upgrade","Tue Nov 19 04:44:31 UTC 2024","passed","Tue Nov 19 04:47:16 UTC 2024","","test_upgrade","",""
"Tests that sharded Charmed MongoDB cluster supports restores.","1594981","test_migrate_restore_backup","tests.integration.sharding_tests","Tue Nov 19 04:49:37 UTC 2024","passed","Tue Nov 19 05:16:12 UTC 2024","","test_sharding_backups","",""
"Test that two different application connect to the database with different credentials.","82026","test_two_applications_doesnt_share_the_same_relation_data","tests.integration.relation_tests.new_relations","Tue Nov 19 04:20:24 UTC 2024","passed","Tue Nov 19 04:21:46 UTC 2024","","test_charm_relations","",""
"Tests juju add-unit functionality.

    Verifies that when a new unit is added to the MongoDB application that it is added to the
    MongoDB replica set configuration.
    ","201900","test_add_units","tests.integration.ha_tests","Tue Nov 19 04:16:16 UTC 2024","passed","Tue Nov 19 04:19:37 UTC 2024","","test_ha","",""
"","946652","test_network_cut","tests.integration.ha_tests","Tue Nov 19 04:37:54 UTC 2024","passed","Tue Nov 19 04:53:41 UTC 2024","","test_ha","",""
"Verify that endpoint still function correctly after a network cut.","528131","test_endpoints_network_cut","tests.integration.metrics_tests","Tue Nov 19 04:15:06 UTC 2024","passed","Tue Nov 19 04:23:54 UTC 2024","","test_metrics","",""
"","5165","test_shards_cannot_run_backup_actions","tests.integration.sharding_tests","Tue Nov 19 04:35:11 UTC 2024","passed","Tue Nov 19 04:35:17 UTC 2024","","test_sharding_backups","",""
"Tests that mongodb is running as a replica set for the application unit.","26","test_unit_is_running_as_replica_set[2]","tests.integration","Tue Nov 19 04:26:35 UTC 2024","passed","Tue Nov 19 04:26:35 UTC 2024","","test_charm","",""
"Verify that a config-server and shard can safely rollback without losing writes.","482377","test_rollback_on_shard_and_config_server","tests.integration.upgrade","Tue Nov 19 04:43:58 UTC 2024","passed","Tue Nov 19 04:52:01 UTC 2024","","test_sharding_rollback","",""
"","829989","test_tls_inconsistent_rels","tests.integration.sharding_tests","Tue Nov 19 05:01:44 UTC 2024","passed","Tue Nov 19 05:15:34 UTC 2024","","test_sharding_tls","",""
"","230094","test_full_cluster_crash","tests.integration.ha_tests","Tue Nov 19 04:29:59 UTC 2024","passed","Tue Nov 19 04:33:49 UTC 2024","","test_ha","",""
"Verify removed applications no longer have access to the database.","23370","test_removed_relation_no_longer_has_access","tests.integration.relation_tests.new_relations","Tue Nov 19 04:23:11 UTC 2024","passed","Tue Nov 19 04:23:34 UTC 2024","","test_charm_relations","",""
"Verifies that using a replica as a shard fails.","3516","test_replication_config_server_relation","tests.integration.sharding_tests","Tue Nov 19 04:26:45 UTC 2024","passed","Tue Nov 19 04:26:48 UTC 2024","","test_sharding_relations","",""
"Tests that the cluster can disable TLS.","57482","test_disable_cluster_with_tls","tests.integration.sharding_tests","Tue Nov 19 04:42:32 UTC 2024","passed","Tue Nov 19 04:43:30 UTC 2024","","test_sharding_tls","",""
"Tests that sharded cluster can successfully create and list backups.","226602","test_rotate_backup_password","tests.integration.sharding_tests","Tue Nov 19 04:35:17 UTC 2024","passed","Tue Nov 19 04:39:03 UTC 2024","","test_sharding_backups","",""
"Deploy both charms (application and database) to use in the tests.","120558","test_deploy_charms","tests.integration.relation_tests.new_relations","Tue Nov 19 04:11:23 UTC 2024","passed","Tue Nov 19 04:13:23 UTC 2024","","test_charm_relations","",""
"Tests that there is exactly one primary in the deployed units.","1054","test_exactly_one_primary","tests.integration","Tue Nov 19 04:26:36 UTC 2024","passed","Tue Nov 19 04:26:38 UTC 2024","","test_charm","",""
"Test verifies that we can set and retrieve the correct password using Juju 3.x secrets.","5481","test_reset_and_get_password_secret_same_as_cli","tests.integration","Tue Nov 19 04:27:10 UTC 2024","passed","Tue Nov 19 04:27:15 UTC 2024","","test_charm","",""
"Tests clusters behavior when scaling down a minority and removing a primary replica.

    - NOTE: on a provided cluster this calculates the largest set of minority members and removes
    them, the primary is guaranteed to be one of those minority members.

    This test verifies that the behavior of:
    1.  when a leader is deleted that the new leader, on calling leader_elected will reconfigure
    the replicaset.
    2. primary stepping down leads to a replica set with a new primary.
    3. removing a minority of units (2 out of 5) is feasiable.
    4. race conditions due to removing multiple units is handled.
    5. deleting a non-leader unit is properly handled.
    ","41911","test_scale_down_capablities","tests.integration.ha_tests","Tue Nov 19 04:19:41 UTC 2024","passed","Tue Nov 19 04:20:23 UTC 2024","","test_ha","",""
"Test that in general, there is no change when password validation fails.","4390","test_no_password_change_on_invalid_password","tests.integration","Tue Nov 19 04:27:20 UTC 2024","passed","Tue Nov 19 04:27:25 UTC 2024","","test_charm","",""
"Build and deploy one unit of MongoDB.","232846","test_build_and_deploy","tests.integration.backup_tests","Tue Nov 19 04:09:27 UTC 2024","passed","Tue Nov 19 04:13:20 UTC 2024","","test_backups","",""
"Verifies that using a replica as a config-server fails.","26489","test_replication_shard_relation","tests.integration.sharding_tests","Tue Nov 19 04:26:48 UTC 2024","passed","Tue Nov 19 04:27:15 UTC 2024","","test_sharding_relations","",""
"","41192","test_freeze_db_process","tests.integration.ha_tests","Tue Nov 19 04:27:54 UTC 2024","passed","Tue Nov 19 04:28:35 UTC 2024","","test_ha","",""
"Verifies that the charm goes into blocked status when s3 creds are incorrect.","38426","test_blocked_incorrect_creds","tests.integration.backup_tests","Tue Nov 19 04:13:20 UTC 2024","passed","Tue Nov 19 04:13:58 UTC 2024","","test_backups","",""
"Verifies that after changing the backup password the pbm tool is updated and functional.","41384","test_update_backup_password","tests.integration.backup_tests","Tue Nov 19 05:03:04 UTC 2024","passed","Tue Nov 19 05:03:45 UTC 2024","","test_backups","",""
"Tests that the cluster can be integrated with TLS.","1094579","test_tls_then_build_cluster","tests.integration.sharding_tests","Tue Nov 19 04:43:30 UTC 2024","passed","Tue Nov 19 05:01:44 UTC 2024","","test_sharding_tls","",""
"","28880","test_an_application_can_connect_to_multiple_aliased_database_clusters","tests.integration.relation_tests.new_relations","Tue Nov 19 04:22:15 UTC 2024","passed","Tue Nov 19 04:22:44 UTC 2024","","test_charm_relations","",""
"Test verifies that only the leader can set a password, while all units can read it.","9307","test_only_leader_can_set_while_all_can_read_password_secret","tests.integration","Tue Nov 19 04:27:00 UTC 2024","passed","Tue Nov 19 04:27:10 UTC 2024","","test_charm","",""
"Verifies charm goes into active status when s3 config and creds options are correct.","392762","test_ready_correct_conf","tests.integration.backup_tests","Tue Nov 19 04:14:17 UTC 2024","passed","Tue Nov 19 04:20:49 UTC 2024","","test_backups","",""
"","47743","test_kill_db_process","tests.integration.ha_tests","Tue Nov 19 04:27:03 UTC 2024","passed","Tue Nov 19 04:27:51 UTC 2024","","test_ha","",""
"Test that an application can connect to different clusters of the same database.","28773","test_an_application_can_connect_to_multiple_database_clusters","tests.integration.relation_tests.new_relations","Tue Nov 19 04:21:46 UTC 2024","passed","Tue Nov 19 04:22:15 UTC 2024","","test_charm_relations","",""
"Verify each unit has TLS enabled after relating to the TLS application.","150781","test_enable_tls","tests.integration.tls_tests","Tue Nov 19 04:29:07 UTC 2024","passed","Tue Nov 19 04:31:38 UTC 2024","","test_tls","",""
"Verify that sharding components cannot use the DB relation.","28796","test_cannot_use_db_relation","tests.integration.sharding_tests","Tue Nov 19 04:26:16 UTC 2024","passed","Tue Nov 19 04:26:45 UTC 2024","","test_sharding_relations","",""
"Tests that right after deployment that the primary unit is the leader.","1085","test_leader_is_primary_on_deployment","tests.integration","Tue Nov 19 04:26:35 UTC 2024","passed","Tue Nov 19 04:26:36 UTC 2024","","test_charm","",""
"Build and deploy a sharded cluster.","416257","test_build_and_deploy","tests.integration.sharding_tests","Tue Nov 19 04:20:25 UTC 2024","passed","Tue Nov 19 04:27:21 UTC 2024","","test_sharding_tls","",""
"Verify that the config-server can safely rollback without losing writes.","608332","test_rollback_on_config_server","tests.integration.upgrade","Tue Nov 19 04:33:41 UTC 2024","passed","Tue Nov 19 04:43:49 UTC 2024","","test_sharding_rollback","",""
"Tests that sharded Charmed MongoDB cluster supports restores.","583428","test_restore_backup","tests.integration.sharding_tests","Tue Nov 19 04:39:28 UTC 2024","passed","Tue Nov 19 04:49:11 UTC 2024","","test_sharding_backups","",""
"Verifies that when the cluster is formed a new user is created.","84541","test_connect_to_cluster_creates_user","tests.integration.sharding_tests","Tue Nov 19 04:25:41 UTC 2024","passed","Tue Nov 19 04:27:05 UTC 2024","","test_mongos","",""
"Tests that sharded cluster can be configured for s3 configurations.","229830","test_set_credentials_in_cluster","tests.integration.sharding_tests","Tue Nov 19 04:31:10 UTC 2024","passed","Tue Nov 19 04:35:00 UTC 2024","","test_sharding_backups","",""
"Simple backup tests that verifies that writes are correctly restored.","230374","test_restore","tests.integration.backup_tests","Tue Nov 19 04:36:13 UTC 2024","passed","Tue Nov 19 04:40:03 UTC 2024","","test_backups","",""
"Build and deploy one unit of MongoDB.","242522","test_build_and_deploy","tests.integration.ha_tests","Tue Nov 19 04:08:51 UTC 2024","passed","Tue Nov 19 04:12:53 UTC 2024","","test_ha","",""
"Verify that the sharded cluster can be safely upgraded without losing writes.","952634","test_upgrade","tests.integration.upgrade","Tue Nov 19 04:34:55 UTC 2024","passed","Tue Nov 19 04:50:48 UTC 2024","","test_sharding_upgrade","",""
"Test superuser actions (ie creating a new user and creating a new database).","602","test_user_with_extra_roles","tests.integration.relation_tests.new_relations","Tue Nov 19 04:20:24 UTC 2024","passed","Tue Nov 19 04:20:24 UTC 2024","","test_charm_relations","",""
"Build deploy, and integrate, a sharded cluster.","753340","test_build_and_deploy","tests.integration.upgrade","Tue Nov 19 04:21:04 UTC 2024","passed","Tue Nov 19 04:33:37 UTC 2024","","test_sharding_rollback","",""
"Tests the immediate integration of cluster components works without error.","360481","test_immediate_relate","tests.integration.sharding_tests","Tue Nov 19 04:22:49 UTC 2024","passed","Tue Nov 19 04:28:50 UTC 2024","","test_sharding_race_conds","",""
"Tests safe removal of a shard that is not primary.","626260","test_removal_of_non_primary_shard","tests.integration.sharding_tests","Tue Nov 19 04:56:51 UTC 2024","passed","Tue Nov 19 05:07:17 UTC 2024","","test_sharding","",""
"Test basic functionality of database relation interface.","130388","test_database_relation_with_charm_libraries","tests.integration.relation_tests.new_relations","Tue Nov 19 04:13:23 UTC 2024","passed","Tue Nov 19 04:15:34 UTC 2024","","test_charm_relations","",""
"Build deploy, and integrate, a sharded cluster.","834586","test_build_and_deploy","tests.integration.upgrade","Tue Nov 19 04:20:55 UTC 2024","passed","Tue Nov 19 04:34:50 UTC 2024","","test_sharding_upgrade","",""
"Verify newly added and newly removed members properly replica data.

    Verify newly members have replicated data and newly removed members are gone without data.
    ","183438","test_replication_member_scaling","tests.integration.ha_tests","Tue Nov 19 04:23:57 UTC 2024","passed","Tue Nov 19 04:27:00 UTC 2024","","test_ha","",""
"Verifies that the application and unit are active.","15109","test_status","tests.integration","Tue Nov 19 04:26:20 UTC 2024","passed","Tue Nov 19 04:26:35 UTC 2024","","test_charm","",""
"Test that an application can request additional databases using the same interface.","26898","test_an_application_can_request_multiple_databases","tests.integration.relation_tests.new_relations","Tue Nov 19 04:22:44 UTC 2024","passed","Tue Nov 19 04:23:11 UTC 2024","","test_charm_relations","",""
"","230052","test_full_cluster_restart","tests.integration.ha_tests","Tue Nov 19 04:33:56 UTC 2024","passed","Tue Nov 19 04:37:46 UTC 2024","","test_ha","",""
"Verifies connecting a replica to a mongos router fails.","23660","test_replication_mongos_relation","tests.integration.sharding_tests","Tue Nov 19 04:27:15 UTC 2024","passed","Tue Nov 19 04:27:39 UTC 2024","","test_sharding_relations","",""
"Build and deploy a sharded cluster.","285285","test_build_and_deploy","tests.integration.sharding_tests","Tue Nov 19 04:20:55 UTC 2024","passed","Tue Nov 19 04:25:41 UTC 2024","","test_mongos","",""
"Test shard removal.

    This test also verifies that:
    - Databases that are using this shard as a primary are moved.
    - The balancer is turned back on if turned off.
    - Config server supp    orts removing multiple shards.
    ","89181","test_shard_removal","tests.integration.sharding_tests","Tue Nov 19 04:55:22 UTC 2024","passed","Tue Nov 19 04:56:51 UTC 2024","","test_sharding","",""
"Tests that there is exactly one replica set primary unit reported by juju.","69622","test_exactly_one_primary_reported_by_juju","tests.integration","Tue Nov 19 04:38:31 UTC 2024","passed","Tue Nov 19 04:39:41 UTC 2024","","test_charm","",""
"Verifies that the dependencies in the charm version are accurate.","1121","test_consistency_between_workload_and_metadata","tests.integration","Tue Nov 19 04:26:19 UTC 2024","passed","Tue Nov 19 04:26:20 UTC 2024","","test_charm","",""
"Tests that sharded cluster can successfully create and list backups.","11228","test_create_and_list_backups_in_cluster","tests.integration.sharding_tests","Tue Nov 19 04:35:00 UTC 2024","passed","Tue Nov 19 04:35:11 UTC 2024","","test_sharding_backups","",""
"Tests the integration of cluster components works without error.","377675","test_cluster_active","tests.integration.sharding_tests","Tue Nov 19 04:47:56 UTC 2024","passed","Tue Nov 19 04:54:14 UTC 2024","","test_sharding","",""
"","10204","test_create_and_list_backups","tests.integration.backup_tests","Tue Nov 19 04:20:49 UTC 2024","passed","Tue Nov 19 04:21:00 UTC 2024","","test_backups","",""
"Verifies that when the cluster is formed a the user is removed.","43310","test_disconnect_from_cluster_removes_user","tests.integration.sharding_tests","Tue Nov 19 04:27:05 UTC 2024","passed","Tue Nov 19 04:27:49 UTC 2024","","test_mongos","",""
"Tests that each cluster component can rotate TLS certs.","470909","test_rotate_tls","tests.integration.sharding_tests","Tue Nov 19 04:34:41 UTC 2024","passed","Tue Nov 19 04:42:32 UTC 2024","","test_sharding_tls","",""
"","77015","test_restart_db_process","tests.integration.ha_tests","Tue Nov 19 04:28:39 UTC 2024","passed","Tue Nov 19 04:29:56 UTC 2024","","test_ha","",""
"","398689","test_restore_new_cluster[AWS]","tests.integration.backup_tests","Tue Nov 19 04:40:28 UTC 2024","passed","Tue Nov 19 04:47:06 UTC 2024","","test_backups","",""
"Scale up and down the application and verify the replica set is healthy.","0","test_scale_up_down_removing_leader","tests.integration.ha_tests","Tue Nov 19 05:19:27 UTC 2024","skipped","Tue Nov 19 05:19:27 UTC 2024","","test_ha","",""
"Build and deploy one unit of MongoDB and one unit of TLS.","485014","test_build_and_deploy","tests.integration.tls_tests","Tue Nov 19 04:21:02 UTC 2024","passed","Tue Nov 19 04:29:07 UTC 2024","","test_tls","",""
"Scale up and down the application and verify the replica set is healthy.","1541001","test_scale_up_down","tests.integration.ha_tests","Tue Nov 19 04:53:44 UTC 2024","broken","Tue Nov 19 05:19:25 UTC 2024","","test_ha","",""
"Verifies that the app metadata changes with db relation joined and departed events.","289700","test_app_relation_metadata_change","tests.integration.relation_tests.new_relations","Tue Nov 19 04:15:34 UTC 2024","passed","Tue Nov 19 04:20:24 UTC 2024","","test_charm_relations","",""
"Tests that mongodb is running as a replica set for the application unit.","27","test_unit_is_running_as_replica_set[0]","tests.integration","Tue Nov 19 04:26:35 UTC 2024","passed","Tue Nov 19 04:26:35 UTC 2024","","test_charm","",""
"Check consistency, ie write to primary, read data from secondaries.","6361","test_replication_across_members","tests.integration.ha_tests","Tue Nov 19 04:20:26 UTC 2024","passed","Tue Nov 19 04:20:32 UTC 2024","","test_ha","",""
"Build and deploy a sharded cluster.","154776","test_build_and_deploy","tests.integration.sharding_tests","Tue Nov 19 04:20:15 UTC 2024","passed","Tue Nov 19 04:22:49 UTC 2024","","test_sharding_race_conds","",""
"Verify unique clusters do not share DBs.","198024","test_unique_cluster_dbs","tests.integration.ha_tests","Tue Nov 19 04:20:35 UTC 2024","passed","Tue Nov 19 04:23:53 UTC 2024","","test_ha","",""
"Verify that endpoints still function correctly after the monitor user password changes.","22349","test_endpoints_new_password","tests.integration.metrics_tests","Tue Nov 19 04:14:44 UTC 2024","passed","Tue Nov 19 04:15:06 UTC 2024","","test_metrics","",""
"Verifies connecting a shard to a mongos router fails.","3490","test_shard_mongos_relation","tests.integration.sharding_tests","Tue Nov 19 04:27:39 UTC 2024","passed","Tue Nov 19 04:27:42 UTC 2024","","test_sharding_relations","",""
"Build and deploy one unit of MongoDB.","320424","test_build_and_deploy","tests.integration","Tue Nov 19 04:20:59 UTC 2024","passed","Tue Nov 19 04:26:19 UTC 2024","","test_charm","",""
"","930633","test_restore_new_cluster[GCP]","tests.integration.backup_tests","Tue Nov 19 04:47:31 UTC 2024","passed","Tue Nov 19 05:03:01 UTC 2024","","test_backups","",""
"Tests that removing a shard application safely drains data.

    It is preferred that users remove-relations instead of removing shard applications. But we do
    support removing shard applications in a safe way.
    ","527630","test_unconventual_shard_removal","tests.integration.sharding_tests","Tue Nov 19 05:07:17 UTC 2024","passed","Tue Nov 19 05:16:05 UTC 2024","","test_sharding","",""
"Verifies that the preflight check can run successfully.","124517","test_preflight_check","tests.integration.upgrade","Tue Nov 19 04:42:26 UTC 2024","passed","Tue Nov 19 04:44:31 UTC 2024","","test_upgrade","",""
"Test that audit log was created and contains actual audit data.","890","test_audit_log","tests.integration","Tue Nov 19 04:27:25 UTC 2024","passed","Tue Nov 19 04:27:26 UTC 2024","","test_charm","",""
"Build and deploy a sharded cluster.","809106","test_build_and_deploy","tests.integration.sharding_tests","Tue Nov 19 04:34:27 UTC 2024","passed","Tue Nov 19 04:47:56 UTC 2024","","test_sharding","",""
"Tests that mongodb is running as a replica set for the application unit.","25","test_unit_is_running_as_replica_set[1]","tests.integration","Tue Nov 19 04:26:35 UTC 2024","passed","Tue Nov 19 04:26:35 UTC 2024","","test_charm","",""
"Test verifies that the monitor user can perform operations such as 'rs.conf()'.","2221","test_monitor_user","tests.integration","Tue Nov 19 04:26:58 UTC 2024","passed","Tue Nov 19 04:27:00 UTC 2024","","test_charm","",""
"Tests writing data to mongos gets propagated to shards.","33829","test_sharding","tests.integration.sharding_tests","Tue Nov 19 04:54:48 UTC 2024","passed","Tue Nov 19 04:55:22 UTC 2024","","test_sharding","",""
"Tests that the cluster can safely set the operator password.","34446","test_set_operator_password","tests.integration.sharding_tests","Tue Nov 19 04:54:14 UTC 2024","passed","Tue Nov 19 04:54:48 UTC 2024","","test_sharding","",""
"Verify rotating tls private keys restarts mongod with new certificates.

    This test rotates tls private keys to randomly generated keys.
    ","155278","test_rotate_tls_key","tests.integration.tls_tests","Tue Nov 19 04:31:38 UTC 2024","passed","Tue Nov 19 04:34:13 UTC 2024","","test_tls","",""
"Verifies that database units with attached storage correctly repurpose storage.

    It is not enough to verify that Juju attaches the storage. Hence test checks that the mongod
    properly uses the storage that was provided. (ie. doesn't just re-sync everything from
    primary, but instead computes a diff between current storage and primary storage.)
    ","197945","test_storage_re_use","tests.integration.ha_tests","Tue Nov 19 04:12:54 UTC 2024","passed","Tue Nov 19 04:16:12 UTC 2024","","test_ha","",""
"Verifies integrating a shard to s3-integrator fails.","7030","test_shard_s3_relation","tests.integration.sharding_tests","Tue Nov 19 04:27:42 UTC 2024","passed","Tue Nov 19 04:27:49 UTC 2024","","test_sharding_relations","",""
"Build and deploy a sharded cluster.","430419","test_build_and_deploy","tests.integration.sharding_tests","Tue Nov 19 04:24:00 UTC 2024","passed","Tue Nov 19 04:31:10 UTC 2024","","test_sharding_backups","",""
"Verifies that the upgrade can run successfully.","307771","test_upgrade","tests.integration.upgrade","Tue Nov 19 04:37:16 UTC 2024","passed","Tue Nov 19 04:42:24 UTC 2024","","test_upgrade","",""
"Build and deploy a sharded cluster.","340468","test_build_and_deploy","tests.integration.sharding_tests","Tue Nov 19 04:20:15 UTC 2024","passed","Tue Nov 19 04:25:56 UTC 2024","","test_sharding_relations","",""
"Tests that the cluster can be integrated with TLS.","439840","test_built_cluster_with_tls","tests.integration.sharding_tests","Tue Nov 19 04:27:21 UTC 2024","passed","Tue Nov 19 04:34:41 UTC 2024","","test_sharding_tls","",""
"Test that the password can't be set to an empty string.","5191","test_empty_password","tests.integration","Tue Nov 19 04:27:15 UTC 2024","passed","Tue Nov 19 04:27:20 UTC 2024","","test_charm","",""
"Verify rotating tls private keys restarts mongod with new certificates.

    This test rotates tls private keys to user specified keys.
    ","160714","test_set_tls_key","tests.integration.tls_tests","Tue Nov 19 04:34:13 UTC 2024","passed","Tue Nov 19 04:36:54 UTC 2024","","test_tls","",""
"Sanity check that endpoints are running.","3301","test_endpoints","tests.integration.metrics_tests","Tue Nov 19 04:14:40 UTC 2024","passed","Tue Nov 19 04:14:44 UTC 2024","","test_metrics","",""
"Build and deploy one unit of MongoDB.","376265","test_build_and_deploy","tests.integration.upgrade","Tue Nov 19 04:30:59 UTC 2024","passed","Tue Nov 19 04:37:15 UTC 2024","","test_upgrade","",""
"Build and deploy one unit of MongoDB.","283376","test_build_and_deploy","tests.integration.metrics_tests","Tue Nov 19 04:09:57 UTC 2024","passed","Tue Nov 19 04:14:40 UTC 2024","","test_metrics","",""
"Verify each unit has TLS disabled after removing relation to the TLS application.","87746","test_disable_tls","tests.integration.tls_tests","Tue Nov 19 04:36:54 UTC 2024","passed","Tue Nov 19 04:38:22 UTC 2024","","test_tls","",""
"Verify that the pre-upgrade check fails if there is a problem with one of the shards.","82918","test_pre_upgrade_check_failure","tests.integration.upgrade","Tue Nov 19 04:50:52 UTC 2024","passed","Tue Nov 19 04:52:15 UTC 2024","","test_sharding_upgrade","",""
"Verify that a shard can only be related to one config server.","20268","test_only_one_config_server_relation","tests.integration.sharding_tests","Tue Nov 19 04:25:56 UTC 2024","passed","Tue Nov 19 04:26:16 UTC 2024","","test_sharding_relations","",""
"Tests that action get-primary outputs the correct unit with the primary replica.","7145","test_get_primary_action","tests.integration","Tue Nov 19 04:26:38 UTC 2024","passed","Tue Nov 19 04:26:45 UTC 2024","","test_charm","",""
"Tests that action set-password outputs resets the password on app data and mongod.","13383","test_set_password_action","tests.integration","Tue Nov 19 04:26:45 UTC 2024","passed","Tue Nov 19 04:26:58 UTC 2024","","test_charm","",""
"Verifies that the charm goes into blocked status when s3 config options are incorrect.","18420","test_blocked_incorrect_conf","tests.integration.backup_tests","Tue Nov 19 04:13:58 UTC 2024","passed","Tue Nov 19 04:14:17 UTC 2024","","test_backups","",""
"With writes in the DB test creating a backup while another one is running.

    Note that before creating the second backup we change the bucket and change the s3 storage
    from AWS to GCP. This test verifies that the first backup in AWS is made, the second backup
    in GCP is made, and that before the second backup is made that pbm correctly resyncs.
    ","887069","test_multi_backup","tests.integration.backup_tests","Tue Nov 19 04:21:01 UTC 2024","passed","Tue Nov 19 04:35:48 UTC 2024","","test_backups","",""
